{
  "$context": "https://schemas.digitalservice.design/v2.0",
  "$type": "Experience",
  "id": "exp-david-procurement",
  "version": "2.0.0",
  "title": "David Chen — Healthcare IT Procurement (Happy Path)",
  "summary": "David's experience leading the evaluation and procurement of a clinical decision support system. He navigates compliance complexity and stakeholder politics while trying to make a defensible, data-driven recommendation within a 6-month window.",
  "references": {
    "actorRef": "actor-david-chen",
    "contextRef": "ctx-it-director-healthcare",
    "missionRef": "mission-healthcare-system-procurement"
  },
  "path": {
    "pathRef": "path-happy",
    "nodeSequence": ["start", "define-requirements", "market-scan", "shortlist", "request-demos", "security-audit", "security-decision", "reference-checks", "business-case", "board-approval", "approval-decision", "contract-negotiation", "implementation-kickoff", "end-success"],
    "actualDuration": "20 weeks"
  },
  "lanes": [
    { "id": "actions", "label": "David's Actions", "type": "list" },
    { "id": "thoughts", "label": "Thoughts", "type": "text" },
    { "id": "emotions", "label": "Emotions", "type": "emotion" },
    { "id": "barriers", "label": "Barriers Encountered", "type": "barrier" },
    { "id": "need-at-step", "label": "Need at This Step", "type": "text" },
    { "id": "pain-at-step", "label": "Pain at This Step", "type": "text" },
    { "id": "opportunities", "label": "Design Opportunities", "type": "list" }
  ],
  "nodes": [
    {
      "nodeRef": "start",
      "laneContent": {
        "actions": ["Receives notification from existing vendor of end-of-life date", "Books initial planning meeting with CTO and clinical governance lead"],
        "thoughts": "Eighteen months to find, evaluate, and implement a replacement. That sounds like a lot until you factor in NHS procurement timelines. I need to start immediately.",
        "emotions": { "state": "focused and slightly anxious", "intensity": 2 }
      }
    },
    {
      "nodeRef": "define-requirements",
      "laneContent": {
        "actions": [
          "Facilitates three stakeholder workshops with clinical leads and operations",
          "Translates clinical needs into technical and compliance requirements",
          "Creates a requirements specification document for sign-off"
        ],
        "thoughts": "The clinical leads know what they need operationally but they can't tell me whether they need HL7 FHIR or just a decent API. I have to translate between two different languages — clinical and technical — and also get this through legal. It's a juggling act.",
        "emotions": { "state": "engaged but stretched", "intensity": 2 },
        "barriers": [
          {
            "type": "communications",
            "description": "Clinical director articulates needs in patient outcome terms; David has to infer the technical specification",
            "severity": 4,
            "emergesFrom": "David's technical expertise clashes with clinical stakeholders' non-technical language — his precision frustrates him when he can't get the specification he needs to proceed safely"
          }
        ],
        "needAtStep": "A structured requirements template that prompts clinical stakeholders with the right questions — without requiring them to know what DSP Toolkit is",
        "opportunities": [
          "Healthcare IT requirements canvas that bridges clinical needs and technical/compliance requirements",
          "Pre-populated NHS compliance requirements to avoid stakeholders having to articulate what they can't know"
        ]
      }
    },
    {
      "nodeRef": "market-scan",
      "laneContent": {
        "actions": [
          "Issues RFI through Find a Tender Service",
          "Searches G-Cloud for pre-approved vendors",
          "Reviews Digital Health Intelligence market report",
          "Sends direct outreach to 4 vendors with known NHS track records"
        ],
        "thoughts": "There are a lot of vendors claiming NHS experience that have done one pilot in a 50-bed community trust. I need to separate genuine NHS-at-scale providers from the ones who've rebranded their generic SaaS with a stock photo of a hospital.",
        "emotions": { "state": "methodical, mild frustration", "intensity": 1 },
        "barriers": [
          {
            "type": "knowledge",
            "description": "Vendor marketing claims are hard to verify without reference calls — market scan produces a list, not a quality signal",
            "severity": 3,
            "emergesFrom": "David's risk-averse, data-driven approach is undermined by a market where genuine NHS credentials are hard to distinguish from aspirational marketing"
          }
        ],
        "needAtStep": "An independent NHS IT vendor registry that shows verified reference sites, DSP compliance status, and implementation track record — not vendor self-reporting"
      }
    },
    {
      "nodeRef": "shortlist",
      "laneContent": {
        "actions": [
          "Scores 12 RFI responses against weighted criteria matrix",
          "Presents shortlist of 4 vendors to internal panel",
          "Secures sign-off from CTO and clinical governance lead"
        ],
        "thoughts": "The scoring is only as good as the criteria. I've weighted compliance at 35%, clinical fit at 30%, commercial at 20%, implementation track record at 15%. But the CTO will want to talk about integration architecture. I need to have that conversation now, not at demo stage.",
        "emotions": { "state": "confident but watchful", "intensity": 1 }
      }
    },
    {
      "nodeRef": "request-demos",
      "laneContent": {
        "actions": [
          "Schedules 4 vendor demonstrations over 3 weeks",
          "Distributes demo evaluation scorecard to panel (6 evaluators)",
          "Sends structured question set to vendors 48 hours before each demo",
          "Attends one reference site visit for the leading vendor"
        ],
        "thoughts": "I sent them the compliance question set in advance. Half of them are still hand-waving on DSP. One vendor actually came with a pre-completed evidence pack — that tells me something about how they'll handle implementation. The others are telling me what I want to hear.",
        "emotions": { "state": "alert, increasingly selective", "intensity": 2 },
        "barriers": [
          {
            "type": "knowledge",
            "description": "Vendors avoid specific answers on DSP Toolkit coverage — it requires persistent follow-up questions that slow the demo flow",
            "severity": 4,
            "emergesFrom": "David's precision and compliance focus collides with vendors who have learned to deflect hard questions — his frustration peaks when technical evasion is dressed up as flexibility"
          }
        ],
        "painAtStep": "Having to chase vendors for DSP evidence packs after the demo. The evaluation scorecard is now blocked on compliance questions, and the clinical panel is impatient to make a decision."
      },
      "momentThatMatters": {
        "description": "One vendor provides a pre-completed DSP evidence pack unprompted — this signals genuine NHS readiness and shifts David's assessment decisively",
        "importance": "critical",
        "emotionalIntensity": 2
      }
    },
    {
      "nodeRef": "security-audit",
      "laneContent": {
        "actions": [
          "Briefs preferred vendor on DSP Toolkit evidence requirements",
          "Coordinates DPO review of Data Processing Agreement",
          "Commissions penetration test from approved third-party supplier"
        ],
        "thoughts": "Our DPO is shared with two other trusts. She has a three-week queue. The vendor's evidence pack is incomplete — they're missing the business continuity element. I can't submit to the DPO until this is resolved. The timeline is slipping.",
        "emotions": { "state": "tense, managing upward pressure", "intensity": 2 },
        "barriers": [
          {
            "type": "resource",
            "description": "Shared DPO creates a bottleneck — David cannot control the audit timeline",
            "severity": 5,
            "emergesFrom": "David's methodical risk management is blocked by organisational resource constraints entirely outside his control — the tension between his professional standards and his capacity to deliver on time is acute"
          }
        ],
        "needAtStep": "A clear checklist of what a complete DSP evidence submission looks like — ideally one the vendor can self-certify against before submission, so the DPO review isn't the first quality check",
        "opportunities": [
          "Vendor DSP pre-submission checklist to shift quality left",
          "Shared NHS DPO capacity model or specialist DPO service for smaller trusts"
        ]
      }
    },
    {
      "nodeRef": "security-decision",
      "laneContent": {
        "actions": [
          "Receives DPO sign-off with two minor conditions",
          "Agrees remediation plan with vendor for outstanding items",
          "Documents decision in procurement log"
        ],
        "thoughts": "Conditional approval with two action items. The vendor accepted both conditions without pushback. That's the right signal — a compliant vendor takes compliance seriously. We can proceed.",
        "emotions": { "state": "relieved, regaining momentum", "intensity": 2 }
      }
    },
    {
      "nodeRef": "reference-checks",
      "laneContent": {
        "actions": [
          "Contacts three NHS organisations known to use the vendor (two from vendor references, one via NHS CIO Network)",
          "Conducts structured 45-minute reference calls focused on implementation, support, and post-go-live compliance"
        ],